[
  {
    "source_id": "nosferatu_1922",
    "title": "Nosferatu",
    "year_published": 1922,
    "files": [
      "nosferatu_1922.mp4"
    ],
    "license": {
      "status": "public_domain",
      "basis": "Published 1922; US copyright expired (95-year term)."
    },
    "audio_license": {
      "status": "stripped",
      "basis": "Original is silent; any accompanying score removed before ingest."
    },
    "verification": {
      "verified_by": "j_okafor",
      "verification_method": "catalog_of_copyright_entries",
      "verified_on": "2026-09-21",
      "next_review_date": "2027-09-21"
    },
    "consent_status": {
      "applicable": false
    },
    "risk_flags": {
      "contains_trademarks": false,
      "contains_architectural_copyright_risk": false,
      "moral_rights_jurisdictions": [
        "DE"
      ]
    }
  },
  {
    "source_id": "synthetic_orbit_test",
    "title": "Synthetic orbit test render (pipeline self-test)",
    "year_published": 2026,
    "files": [
      "orbit_test.mp4"
    ],
    "license": {
      "status": "commissioned",
      "basis": "Generated procedurally by this repo's own test harness; no third-party content."
    },
    "audio_license": {
      "status": "not_applicable",
      "basis": "Silent render; no audio stream."
    },
    "verification": {
      "verified_by": "pipeline_self_test",
      "verification_method": "other",
      "verification_method_detail": "Synthetic render produced in-repo; provenance is the generating script itself.",
      "verified_on": "2026-09-21",
      "next_review_date": "2027-09-21"
    },
    "consent_status": {
      "applicable": false,
      "notes": "No people depicted; purely procedural geometry."
    },
    "risk_flags": {
      "contains_trademarks": false,
      "contains_architectural_copyright_risk": false,
      "moral_rights_jurisdictions": []
    }
  },
  {
    "source_id": "room_walkthrough",
    "title": "Room walkthrough (owner-captured handheld video)",
    "year_published": 2026,
    "files": [
      "room_walkthrough.mp4"
    ],
    "license": {
      "status": "commissioned",
      "basis": "Captured by the repository owner on their own device, in their own private space. No third-party footage."
    },
    "audio_license": {
      "status": "stripped",
      "basis": "Source has an AAC track; audio is not used by the pipeline and is discarded at extraction. May contain incidental speech."
    },
    "verification": {
      "verified_by": "repository_owner",
      "verification_method": "other",
      "verification_method_detail": "First-party capture: the owner supplied the file directly from their own device.",
      "verified_on": "2026-09-21",
      "next_review_date": "2027-09-21"
    },
    "consent_status": {
      "applicable": false,
      "notes": "No identifiable persons observed in sampled frames. If any person appears in the full footage, this must flip to applicable=true with releases on file before any asset is published."
    },
    "risk_flags": {
      "contains_trademarks": true,
      "contains_architectural_copyright_risk": false,
      "moral_rights_jurisdictions": [],
      "notes": "Domestic interior: branded appliances and product packaging are visible on the desk and AC unit. Surfaced, NOT cleared - review before any public export."
    }
  }
]